{
  "$schema": "https://json-schema.org/draft/2020-12/schema",
  "additionalProperties": false,
  "properties": {
    "acquisitions": {
      "minItems": 1,
      "type": "array"
    },
    "fixtures": {
      "minProperties": 1,
      "type": "object"
    },
    "protocols": {
      "minItems": 1,
      "type": "array"
    },
    "schema_version": {
      "const": "digital_shoe_acquisition_1"
    },
    "splits": {
      "type": "object"
    },
    "study": {
      "type": "object"
    }
  },
  "required": [
    "schema_version",
    "study",
    "fixtures",
    "protocols",
    "acquisitions",
    "splits"
  ],
  "title": "Digital Shoe acquisition manifest",
  "type": "object"
}
